BLUE PLAQUE DATABASE - NOKIA MAPS,,,,,,,,,,,,,,,,,58,Sir ,Charles,Lyell,1797-1875,73 Harley Street,Marylebone,51.5197,-0.1473,Science & Engineering,,Geologist,,In a house on this site lived from 1854-1875 SIR CHARLES LYELL Geologist and from 1876-1882 W.E. GLADSTONE Statesman,http://en.wikipedia.org/wiki/Charles_Lyell,"This building first housed Sir Charles Lyell (1797-1875) a British lawyer who was the foremost geologist of his day. He is best known as the author of Principles of Geology, which popularised James Hutton's concepts of uniformitarianism – the idea that the earth was shaped by slow-moving forces still in operation today. Lyell was a close and influential friend of Charles Darwin. Following his death the house was occupied by William Ewart Gladstone (1809-1898). Gladstone was a British Liberal statesman who, in a career lasting over sixty years, served as Prime Minister four times (more than any other person). Gladstone is famous for his oratory, his rivalry with the Conservative leader Benjamin Disraeli and his poor relations with Queen Victoria. ",,59,,Thomas,Young,1773-1829,48 Welbeck Street,Marylebone,51.5158,-0.148481,Science & Engineering,,Scientist,Egyptology,"Thomas Young (1773-1829) Man of Science lived here * He is famous for having partly deciphered Egyptian hieroglyphics (specifically the Rosetta Stone) before Jean-François Champollion eventually expanded on his work. He was admired by, among others, Herschel and Einstein.",http://en.wikipedia.org/wiki/Thomas_Young_(scientist),"Thomas Young (1773-1829) was an English polymath, scientist and Egyptologist. He is famous for having partly deciphered Egyptian hieroglyphics (specifically the Rosetta Stone) before Jean-François Champollion eventually expanded on his work. He was admired by, among others, Herschel, Helmholtz, Maxwell, and Einstein.Young made notable scientific contributions to the fields of vision, light, solid mechanics, energy, physiology, language, musical harmony and Egyptology. One of the most important contributions to science was to establish the wave theory of light - that light is not a particle, but rather emitted in all directions as a series of waves, rather like sound. ",,60,Sir,Francis,Beaufort,1774-1857,51 Manchester Street,Marylebone,51.5179,-0.153647,Science & Engineering,,Admiral,Hydrographer,SIR FRANCIS BEAUFORT 1774-1857 Admiral and Hydrographer lived here,http://en.wikipedia.org/wiki/Sir_Francis_Beaufort,"Rear-Admiral Sir Francis Beaufort (1774-1857) was an Irish hydographer and officer in Britain's Royal Navy. Beaufort had a lifelong keen awareness of the value of accurate charts for those risking the seas, having been shipwrecked himself at age fifteen due to a faulty chart, and his life's biggest accomplishments were in nautical charting. As a naval officer Beaufort commanded HMS Woolwich which was tasked with charting the Rio de la Plata estuary of South America. It was during his sea voyages that Beaufort developed the first versions of his Wind Force Scale and Weather Notation coding - now known as the Beaufort scale. ",,61,,James,Smithson,1764-1829,9 Bentinck Street,Marylebone,51.5171,-0.150167,Science & Engineering,,Scientist,,JAMES SMITHSON 1764-1829 Scientist Founder of the Smithsonian Institution lived here,http://en.wikipedia.org/wiki/James_Smithson,"James Smithson (1764-1829) was a British mineralogist and chemist. Not much is known about Smithson's life as his archive of collections, notebooks, diaries and correspondence was destroyed by fire in 1855 but it clear that he had a keen interest in minerals and the study of the natural world. He was made a Fellow of the Royal Society in 1787, then the youngest person to be so. A shrewd investor, Smithson bequeathed a small fortune to the United States of America upon his death to create ""an establishment for the increase and diffusion of knowledge among men."" It became the Smithsonian Institute. ",,62,Major-General,William,Roy,1726-1790,10 Argyll Street,Soho,51.5147,-0.140827,Science & Engineering,,Scientist,Founder,MAJOR-GENERAL WILLIAM ROY 1726-1790 Founder of the Ordnance Survey lived here,http://en.wikipedia.org/wiki/William_Roy,"Major-General William Roy FRS (1726 – 1790) was a Scottish military engineer, surveyor, and antiquarian. He was an innovator who applied new scientific discoveries and newly emerging technologies to the accurate geodetic mapping of Great Britain. It was Roy's advocacy and leadership that led to the creation of the Ordnance Survey in 1791, the year after his death. His technical work in the establishment of a surveying baseline won him the Copley Medal in 1785. His maps and drawings of Roman archaeological sites in Scotland were the first accurate and systematic study of the subject, and have not been improved upon even today. Roy was a Fellow of the Royal Society and a member of the Society of Antiquaries of London.",,63,,Thomas Henry,Huxley,1825-1895,38 Marlborough Place,St John's Wood,51.5346,-0.180806,Science & Engineering,,Biologist,,"THOMAS HENRY HUXLEY 1825-1895 Biologist Lived Here * Known for his advocacy of Evolution, In 1869 Huxley coined the term 'agnostic' to describe his own views on theology,",http://en.wikipedia.org/wiki/Thomas_Henry_Huxley,"Thomas Henry Huxley (1825-1895) was an English biologist, known as ""Darwin's Bulldog"" for his advocacy of Charles Darwin's theory of evolution. Huxley's famous 1860 debate with Samuel Wilberforce was a key moment in the wider acceptance of evolution, and in his own career. He was instrumental in developing scientific education in Britain, and fought against the more extreme versions of religious tradition. In 1869 Huxley coined the term 'agnostic' to describe his own views on theology, a term whose use has continued to the present day. Huxley had little formal schooling and taught himself almost everything he knew. He became perhaps the finest comparative anatomist of the latter 19th century. ",,64,Sir,Ambrose,Fleming,1849-1945,9 Clifton Gardens,Maida Vale,51.5239,-0.182951,Science & Engineering,,Scientist,Electrical,"Sir AMBROSE FLEMING 1849-1945 Scientist and Electrical Engineer lived here * He is known for inventing the first thermionic valve or vacuum tube, the diode, then called the kenotron in 1904.[2] He is also famous for the left hand rule (for electric motors).",http://en.wikipedia.org/wiki/Sir_Ambrose_Fleming,"Sir John Ambrose Fleming (1849-1945) was an English electrical engineer and physicist. As an engineering consultant for firms including Edison Telephone and the Marconi company, Fleming made a significant breakthrough in 1904 when he developed a device he called an ""oscillation valve"" which soon became known as the Fleming Valve and was an early type of diode. Today, descendants of the original valve (or vacuum tube) still play an important role in a range of applications. They can be found in the power stages of radio and television transmitters, in some high-end audio amplifiers, as detectors of optical and short wavelength radiation, and in sensitive equipment that must be ""radiation-hard"".",,65,Sir,Isaac,Newton,1642-1727,87 Jermyn Street,St James's,51.5081,-0.137501,Science & Engineering,,Physicist,,SIR ISAAC NEWTON 1642-1727 Lived Here,http://en.wikipedia.org/wiki/Isaac_Newton,"Sir Isaac Newton (1642-1727) was an English physicist, mathematician, astronomer, natural philosopher, alchemist, and theologian, who has been ""considered by many to be the greatest and most influential scientist who ever lived."" Newton's theory of universal gravitation - where motions of objects on Earth and of celestial bodies are governed by the same set of natural laws advanced the Scientific Revolution. Newton lived here when he was appointed warden of the Royal Mint in 1696; an appointment he took very seriously and campaigned against corruption and inefficiency in the organisation. In 1703, he was elected president of the Royal Society, an office he held until his death. ",,66,,Hertha,Ayrton,1854-1923,41 Norfolk Square,Paddington,51.515915,-0.173072,Science & Engineering,,Physicist,,"HERTHA AYRTON 1854-1923 Physicist lived here 1903-1923 * In 1899, she was the first woman ever to read her own paper before the Institution of Electrical Engineers (IEE). Shortly thereafter, she was elected the first female member of the IEE.",http://en.wikipedia.org/wiki/Hertha_Ayrton,"Hertha Ayrton (1854-1923) was an English engineer, mathematician and inventor. Ayrton was educated at Girton College, Cambridge and gained a degree from the University of London in 1881. Through her marriage to William Edward Ayrton, a teacher, she began investigations into the electric arc. In 1899, she was the first woman ever to read a paper before the Institution of Electrical Engineers (IEE) and was shortly thereafter elected the first female member of the IEE. Ayrton was agnostic, but kept close ties to the Jewish faith, establishing the Jewish League for Women Suffrage in 1912. ",,67,,Aldous,Huxley,1894-1963,16 Bracknell Gardens,Hampstead,51.5542,-0.188218,Science & Engineering,Arts,Science,Writer,LEONARD HUXLEY 1860-1933 JULIAN HUXLEY 1887-1975 ALDOUS HUXLEY 1894-1963 Men of Science and Letters lived here,http://en.wikipedia.org/wiki/Aldous_Huxley,"Three members of the great Huxley family lived here: Leonard Huxley (1860-1933) the most prominent son of Thomas Henry Huxley (the scientist and Darwin's greatest supporter), Sir Julian Huxley (1887-1975) and Aldous Huxley (1894-1963). Leonard was a teacher and writer whose major work was a biography of his father. Julian was a prominent zoologist, and was the first Director-General of UNESCO and also the co-founder of the World Wildlife Fund who did much to further Darwin's theory of evolution. Aldous was a novelist of great fame who wrote in an iconoclastic style that was often disenchanted and with a dystopian view, ""Brave New World"" being the most famous. ",,67,,Julian,Huxley,1887-1975,16 Bracknell Gardens,Hampstead,51.5542,-0.188218,Science & Engineering,Arts,Science,Writer,LEONARD HUXLEY 1860-1933 JULIAN HUXLEY 1887-1975 ALDOUS HUXLEY 1894-1963 Men of Science and Letters lived here,http://en.wikipedia.org/wiki/Julian_Huxley,"Three members of the great Huxley family lived here: Leonard Huxley (1860-1933) the most prominent son of Thomas Henry Huxley (the scientist and Darwin's greatest supporter), Sir Julian Huxley (1887-1975) and Aldous Huxley (1894-1963). Leonard was a teacher and writer whose major work was a biography of his father. Julian was a prominent zoologist, and was the first Director-General of UNESCO and also the co-founder of the World Wildlife Fund who did much to further Darwin's theory of evolution. Aldous was a novelist of great fame who wrote in an iconoclastic style that was often disenchanted and with a dystopian view, ""Brave New World"" being the most famous. ",,67,,Leonard,Huxley,1860-1933,16 Bracknell Gardens,Hampstead,51.5542,-0.188218,Science & Engineering,Arts,Science,Writer,LEONARD HUXLEY 1860-1933 JULIAN HUXLEY 1887-1975 ALDOUS HUXLEY 1894-1963 Men of Science and Letters lived here,http://en.wikipedia.org/wiki/Leonard_Huxley_(writer),"Three members of the great Huxley family lived here: Leonard Huxley (1860-1933) the most prominent son of Thomas Henry Huxley (the scientist and Darwin's greatest supporter), Sir Julian Huxley (1887-1975) and Aldous Huxley (1894-1963). Leonard was a teacher and writer whose major work was a biography of his father. Julian was a prominent zoologist, and was the first Director-General of UNESCO and also the co-founder of the World Wildlife Fund who did much to further Darwin's theory of evolution. Aldous was a novelist of great fame who wrote in an iconoclastic style that was often disenchanted and with a dystopian view, ""Brave New World"" being the most famous. ",,68,Sir,William,Ramsay,1852-1916,12 Arundel Gardens,Notting Hill,51.5139,-0.205393,Science & Engineering,,Chemist,,Sir WILLIAM RAMSAY 1852-1916 Chemist Discoverer of the Noble Gases lived here 1887-1902,http://en.wikipedia.org/wiki/William_Ramsay,"Sir William Ramsay (1852-1916) was a Scottish chemist who is most famous for his work in discovering the noble gases. Ramsay was born in Glasgow, Scotland and studied at both Glasgow Academy and the University of Glasgow. After a period in Bristol, Ramsay was appointed chair of Chemistry at University College London in 1887. It was at UCL that his most celebrated discoveries were made - isolating a heavy component of air which did not appear to have any obvious chemical reactivity (he named this ""argon""), then neon, krypton, xenon and helium discoveries in the following years. He received the Nobel Prize in Chemistry in 1904. ",,69,Sir,William,Crookes,1832-1919,7 Kensington Park Gardens,Notting Hill,0.0,0.0,Science & Engineering,,Scientist,,"SIR WILLIAM CROOKES 1832-1919 SCIENTIST lived here from 1880 until his death * He was a pioneer of vacuum tubes, inventing the Crookes tube",http://en.wikipedia.org/wiki/Sir_William_Crookes,"Sir William Crookes (1832-1919) was a British chemist and physicist who attended the Royal College of Chemistry, London and who was a pioneer of vacuum tubes, inventing the Crookes tube. Crookes was born in London and roe to prominence as a chemist in the 1850s, working under AW Hofmann. It was at 7 Kensington Gardens, Crookes's home, that much of his most notable work was done. As well as discovering the chemical element thallium, Crookes also pioneered the use of vacuum tubes; he developed the Crookes radiometer becoming one of the first scientists to investigate what are known today as plasmas. ",,70,,Chaim,Weizmann,1874-1952,67 Addison Road,Holland Park,51.5003,-0.208006,Science & Engineering,Politics,Scientist,Statesman,Chaim Weizmann (1874-1952) Scientist and Statesman First President of the State of Israel lived here,http://en.wikipedia.org/wiki/Chaim_Weizmann,"Chaim Weizmann (1874-1952) was a scientist and politician who became the first President of the State of Israel in 1949. Weizmann was born in Russia and studied in Switzerland before moving to Manchester as lecturer of Chemistry at the university. During WWI, he was credited with developing a method of producing acetone from maize; which was needed for the production of artillery shells. It was in London that Weizmann was successful in procuring from Arthur James Balfour the Balfour Declaration of 1917 in which the British government supported the creation of a Zionist state in Palestine. ",,71,Sir,Norman,Lockyer,1836-1920,16 Penywern Road,Earls Court,51.4911,-0.193222,Science & Engineering,,Astronomer,Physicist,"Sir NORMAN LOCKYER 1836-1920 Astronomer, Physicist and Founder of Nature lived here 1876-1920",http://en.wikipedia.org/wiki/Norman_Lockyer,"Norman Lockyer (1836-1920) was an English scientist and astronomer. It was in the 1860s that Lockyer became fascinated with electromagnetic spectroscopy (the study of the interaction between matter and radiated energy). Working in London, Lockyer observed an unknown element emitted from the sun which he named ""helium"" from the Greek word ""Helios"" meaning sun. As well as his astronomical work, Lockyer also founded the journal ""Nature"" in 1869, to facilitate the transmission of ideas between scientists. ",,72,Sir,Charles,Barry,1795-1860,"The Elms, 29-32 Clapham Common North Side",Clapham Common,51.4620561,-0.145720392,Science & Engineering,,Architect,,Sir Charles Barry (1795-1860) Architect lived and died here * best known for his role in the rebuilding of the Palace of Westminster (also known as the Houses of Parliament) in London during the mid-19th century,http://en.wikipedia.org/wiki/Sir_Charles_Barry,"Sir Charles Barry (1795-1860) was an English architect who is best known for his role in the rebuilding of the Palace of Westminster, also known as the Houses of Parliament. Barry travelled extensively throughout Europe and the Middle East from 1817-1820, before working for the Church Commissioners in the Gothic Revival architecture style. Barry made a significant contribution to the Italian Renaissance garden fashions of Victorian Britain, inspired by his travels. Barry's most significant work was the design of the Palace of Westminster after it was destroyed by fire in 1834. He also remodelled Trafalgar Square. Barry lived in Clapham until his death in 1860. ",,73,,John Francis ,Bentley,1839-1902,43 Old Town,Clapham,51.4641,-0.141177,Science & Engineering,,Architect,,"John Francis Bentley (1839-1902) Architect lived here * most famous work is the Westminster Cathedral in London, England,",http://en.wikipedia.org/wiki/John_Francis_Bentley,"John Francis Bentley (1839-1902) was an English ecclesiastical architect. Bentley was born in Doncaster and trained as an architect in the offices of Henry Clutton. Bentley's most imporant commission was that of the Westminster Cathedral in 1894. As he had mastered the neo-Gothic and Byzantine Revivalist styles thoughout his career, Bentley decided to travel to Italy to study some of the most important Byzantine-influenced cathedrals, such as St Mark's Basilica in Venice, which provided much of the inspiration for Westminster Cathedral. ",,74,,"Lancelot ""Capability""",Brown,1716-1783,"Wilderness House, Hampton Court Palace",Hampton Court,51.4036225,-0.3390538,Science & Engineering,,Architect,,Lancelot 'Capability' BROWN 1716-1783 Landscape Architect lived here 1764-1783,http://en.wikipedia.org/wiki/Capability_Brown,"Lancelot ""Capability"" Brown (1716-1783) was a pioneering landscape architect. Brown began his career at Stowe, Buckinghamshire, under William Kent, one of the founders of the new English style of landscape garden. As a proponent of this style, Brown became quickly sought after by families all over the country. Brown was coined ""Capability"" because he would often tell his clients that their estates had great ""capability"" for improvement. It is estimated that Brown worked on over 170 gardens,  and in 1764 he was appointed master gardener at Hampton Court Palace. He is today regarded as ""England's greatest gardener.""",,75,,William,Butterfield,1814-1900,42 Bedford Square,Bloomsbury,51.518,-0.130269,Science & Engineering,,Architect,,WILLIAM BUTTERFIELD 1814-1900 Architect lived here * a Gothic Revival architect and associated with the Oxford Movement (or Tractarian Movement). He is noted for his use of polychromy,http://en.wikipedia.org/wiki/William_Butterfield,"William Butterfield (1814-1900) was an English architect who pioneered the Gothic Revivalist style of the Victorian era. Butterfield was born to non-conformist parents in London and after training with several notable architects he set up his own practice in 1840. Butterfield's style was heavily influenced by the Cambridge Camden Society, of which he was a member, who promoted the study of Gothic Architecture. Butterfield was also famous for his use of polychromy (the multiple use of colours in brickwork) which can be seen in his design of Rugby School in Warwickshire and Keble College at Oxford. ",,76,,Colen,Campbell ,1676-1729,76 Brook Street,Mayfair,51.5125,-0.149179,Science & Engineering,,Architect,,Colen Campbell (1676-1729) Architect lived and died here *  credited as a founder of the Georgian style,http://en.wikipedia.org/wiki/Colen_Campbell,"Colen Campbell (1676-1729) was a pioneering Scottish architect. Having initially trained as a lawyer in Edinburgh, Campbell decided to move to London to train as an architect. His highly influential published work ""Vitruvius Britannicus"" which appeared in three volumes between 1715 and 1725 was instrumental in popularising the neo-Palladium style which came to dominate early eighteenth century architecture. Under the guidance of Lord Burlington, Campbell worked on buildings such as the Royal Academy in London and Stourhead in Wiltshire. Campbell is widely credited as one of the founders of the Georgian style of architecture. ",,77,,William Richard,Lethaby,1857-1931,"Central School of Arts and Crafts, Southampton Row",Holborn,51.5195,-0.121737,Science & Engineering,,Architect,,William Richard Lethaby (1857-1931) Architect and first principal of this school in 1896-1911,http://en.wikipedia.org/wiki/William_Richard_Lethaby,"William Richard Lethaby (1857-1931) was an English architect whose ideas were influential on the late Arts and Crafts and early Modern movements. In 1894 Lethaby was appointed Art Inspector to the Technical Education Board of the newly formed London County Council. Here he had a pioneering role in developing education in the fine and practical arts, most notably as the founder of the Central School of Arts and Crafts in 1896. His most significant innovations lay in breaking down academic barriers between design (perceived as an artistic and intellectual pursuit) and production (widely perceived as the less sophisticated activity of the craftsman or artisan). Lethaby believed that this was an artificial distinction and sought to have both taught as equally valuable parts of the process of producing a high quality end-product.",,78,,Frank,Matcham,1854-1920,10 Haslemere Road,Crouch End,0.0,0.0,Science & Engineering,Arts,Architect,Theatre,Frank Matcham 1854-1920 Theatre Architect lived here 1895-1904,http://en.wikipedia.org/wiki/Frank_Matcham,"Frank Matcham (1854-1920) was a pioneering English architect who desgned over 200 theatres throughout Britain between 1890-1915. Matcham inherited his father-in-law's architectural practice in 1878, from where his most famous designs were made - these include the Hackney Empire, London Coliseum and the Victoria Palace theatre. By the outbreak of the First World War no significant town was without its theatre or music hall. Matcham's success lay in his innovative steel cantilevers which, when used in constructing the theatre space, allowed balconies to be built without pillars, thus improving sight lines for the audience. He also set new standards in safety and his work was extremely popular with the public. ",,79,,John Loughborough,Pearson,1817-1897,13 Mansfield Street,Marylebone,51.5193,-0.146102,Science & Engineering,,Architect,,Here lived and died JOHN LOUGHBOROUGH PEARSON 1817-1897 and later SIR EDWIN LANDSEER LUTYENS 1869-1944 Architects,http://en.wikipedia.org/wiki/John_Loughborough_Pearson,"Two pioneering architects of the late nineteenth and early twentieth centuries lived in this house. The first inhabitant was John Loughborough Pearson (1817-1897) who was one of the foremost Gothic Revivalist architects of the late-Victorian era. He was renowned for his work on churches and cathedrals in Britain, including a proficiency for the art of vaulting. His most famous work is Truro Cathedral. He lived for much of his life in Mansfield Street, London, and was awarded the RIBA gold medal in 1880. The second inhabitant was Edwin Lutyens (1869-1944) who was an English architect and designer. Through a long industrious career Lutyens contributed much to the architecture of the British nation and Commonwealth and is often referred to as ""the greatest English architect of all time."" Born in London in 1869, Lutyens studied at what is now the Royal College of Art before starting his own practice in 1885. Lutyens is closely associated with the commemoration of the First World War through his designs, most notably the Cenotaph in Whitehall. Lutyens was also commissioned to design New Delhi, which was chosen to replace the seat of the British Indian government in 1912 and is known today as ""Lutyens Delhi.""",,79,Sir,Edwin,Landseer Lutyens,1869-1944,13 Mansfield Street,Marylebone,51.5193,-0.146102,Science & Engineering,,Architect,,Here lived and died JOHN LOUGHBOROUGH PEARSON 1817-1897 and later SIR EDWIN LANDSEER LUTYENS 1869-1944 Architects,http://en.wikipedia.org/wiki/Edwin_Lutyens,"Two pioneering architects of the late nineteenth and early twentieth centuries lived in this house. The first inhabitant was John Loughborough Pearson (1817-1897) who was one of the foremost Gothic Revivalist architects of the late-Victorian era. He was renowned for his work on churches and cathedrals in Britain, including a proficiency for the art of vaulting. His most famous work is Truro Cathedral. He lived for much of his life in Mansfield Street, London, and was awarded the RIBA gold medal in 1880. The second inhabitant was Edwin Lutyens (1869-1944) who was an English architect and designer. Through a long industrious career Lutyens contributed much to the architecture of the British nation and Commonwealth and is often referred to as ""the greatest English architect of all time."" Born in London in 1869, Lutyens studied at what is now the Royal College of Art before starting his own practice in 1885. Lutyens is closely associated with the commemoration of the First World War through his designs, most notably the Cenotaph in Whitehall. Lutyens was also commissioned to design New Delhi, which was chosen to replace the seat of the British Indian government in 1912 and is known today as ""Lutyens Delhi.""",,80,,William ,Morris,1834-1896,Red House Lane,Bexleyheath,51.4556,0.130278,Arts,,Poet,Artist,"RED HOUSE built in 1859-1860 by Philip Webb, architect for WILLIAM MORRIS poet and artist who lived here 1860-1864",http://en.wikipedia.org/wiki/William_Morris,"Red House in Bexleyheath is one of the most important buildings in the history of the Arts and Crafts movement and of nineteenth century architecture. It was designed by William Morris and Philip Webb in 1859 as a home for Morris and his wife Jane. The house was designed to be a ""palace of art"" for Morris and his friends; the windows and wall paintings were created by Edward Burne-Jones. Morris and his family lived for only five years in Red House and were forced to sell for financial reasons. Now owned by the National Trust the house is preserved to give an insight into the truly iconic work of its designers and artists of the time. ",,