BLUE PLAQUE DATABASE - NOKIA MAPS,,,,,,,,,,,,,,,,,31,,Thomas,Earnshaw,1749-1829,119 High Holborn,Holborn,51.5176,-0.12,Science & Engineering,,Inventor,,Site of the business premises of Thomas Earnshaw 1749-1829 noted watch and chronometer maker,http://en.wikipedia.org/wiki/Thomas_Earnshaw,"Thomas Earnshaw (1749-1829) was an English watchmaker who following John Arnold's earlier work, further simplified the process of marine chronometer production, making them available to the general public. He is also known for his improvements to the transit clock at the Royal Greenwich Observatory in London and his invention of a chronometer escapement and a form of bimetallic compensation balance, for this he is known as a pioneer of chronometer development. An Earnshaw chronometer was used aboard HMS Beagle, during Charles Darwin's voyage that inspired his theory of evolution. ",,32,,John Desmond,Bernal,1901-1971,44 Albert Street,Camden,51.5342,-0.141498,Science & Engineering,,Inventor,Crystallographer,John Desmond Bernal 1901-1971 Crystallographer lived and died here * known for pioneering X-ray crystallography in molecular biology,http://en.wikipedia.org/wiki/John_Desmond_Bernal,"John Desmond Bernal (1901-1971) was a British physicist known for his studies of the atomic structure of solid compounds, during which he made major contributions to X-ray crystallography. At Cambridge University, Bernal initiated a research program of X-ray investigations into the structure of complex biological molecules that resulted in Nobel-level discoveries by his students and co-workers. Bernal also made a significant contribution to the Normandy landings of World War Two, comprehensively mapping the coast line and helping design an artificial harbour called the Mulberry. ",,33,,Charles,Darwin,1809-1882,"Biological Sciences Building, University College, (site of 110) Gower Street",Bloomsbury,51.5232,-0.133421,Science & Engineering,,Naturalist,Science,Charles Darwin 1809-1882 Naturalist lived in a house on this site 1838-1842,http://en.wikipedia.org/wiki/Charles_Darwin,"Charles Robert Darwin (1809-1882) was an English naturalist who has been described as one of the most influential figures in human history. Darwin established that all species of life have descended over time from common ancestry, and proposed that the scientific theory that this branching pattern of evolution resulted from a process he called natural selection. Darwin lived in a house formerly occupying this site from 1838-1842, a time when he first conceived his theory of natural selection. ",,34,,August Wilhelm,Hofmann,1818-1892,9 Fitzroy Square,Fitzrovia,51.5234,-0.140026,Science & Engineering,,Chemistry,,A.W. HOFMANN 1818-1892 Professor of Chemistry lived here ,http://en.wikipedia.org/wiki/August_Wilhelm_von_Hofmann,"August Wilhelm von Hofmann (1818-1892) was a German chemist. In 1845 a school of practical chemistry was started in London, under the style of the Royal College of Chemistry, Hofmann, largely through the influence of Prince Albert, was appointed its first director. It was known as the Royal College of Chemistry and eventually became part of Imperial College London. As well as his considerable contribution to chemistry, Hofmann was also the first to introduce molecular models into public lecturers in around 1860 and his colour scheme is still in use today: carbon = black, hydrogen = white, nitrogen = blue, oxygen = red, chlorine = green, and sulphur = yellow. ",,35,,Augustus,Siebe,1788-1872,5 Denmark Street,St Giles,51.5153,-0.129434,Science & Engineering,,Pioneer,inventor,AUGUSTUS SIEBE 1788-1872 Pioneer of the Diving Helmet lived and worked here,http://en.wikipedia.org/wiki/Augustus_Siebe,"Augustus Siebe (1788-1872) was a German-born British engineer chiefly known for his contributions to diving equipment. Siebe moved to London in 1816 where he became a watchmaker, then gun maker, then instrument maker and settled at 5 Denmark Street where he became an engineer in 1826. Siebe began designing and building diving equipment in 1830 when he was approached by the Deane brothers, producing a helmet fitted to a full length watertight canvas diving suit. This design became standard diving dress which revolutionised underwater civil engineering, underwater salvage, commercial diving and naval diving. ",,36,,Ebenezer,Howard,1850-1928,50 Durley Road,Stamford Hill,51.5731,-0.079333,Science & Engineering,,Pioneer,,Ebenezer Howard 1850-1928 Pioneer of the Garden City Movement,http://en.wikipedia.org/wiki/Ebenezer_Howard,"Sir Ebenezer Howard (1850-1928) is known for his publication ""Garden Cities of Tomorrow"" (1898), the description of a utopian city in which people live harmoniously together with nature. Howard's vision was of a city of 32,000 people on a site of 6000 hectares planned on a concentric pattern with open spaces, public parks and six radial boulevards extending from the centre. The publication resulted in the founding of the garden city movement, that realised several garden cities in Great Britain following the passing of the New Towns Act in 1946. The movement was also of great influence in America. ",,37,,Frances Mary,Buss,1827-1894,"Camden School for Girls, Sandall Road",Kentish Town,51.5462,-0.134283,Politics,,Pioneer,Education,Frances Mary Buss 1827-1898 Pioneer of Education of Women was Headmistress here 1879-1894,http://en.wikipedia.org/wiki/Frances_Mary_Buss,"Frances Mary Buss (1827-1894) was a headmistress and an English pioneer of women's education. Buss was at the forefront of campaigns for the endowment of girls' schools, and for girls to be allowed to sit public examinations and to enter universities, as well as women's right to vote. The daughter of Robert William Buss and Frances Fleetwood, Buss attended a local free school where she began teaching at the age of fourteen. After training at Queen's College, Buss established the North London Collegiate School for Girls in 1850, which soon developed an excellent reputation for its teaching, and Camden School for Girls in 1871, where she was headmistress until her death in 1894. ",,38,,George,Orwell,1903-1950,50 Lawford Road,Kentish Town,51.5463,-0.135934,Arts,Politics,Novelist,Politicial Essayist,George Orwell (1903-1950) Novelist and political essayist lived here,http://en.wikipedia.org/wiki/George_Orwell,"Eric Arthur Blair (1903-1950) better known by his pen name George Orwell, was an English novelist and journalist. Considered perhaps the 20th century's best chronicler of English culture, Orwell wrote literary criticism, poetry, fiction and polemical journalism. He is best known for the dystopian novel Nineteen Eighty-Four (1949) and the allegorical novella Animal Farm (1945), which together have sold more copies than any two books by any other 20th-century author. Orwell's influence on popular and political culture endures, and several of his neologisms, along with the term Orwellian — a byword for totalitarian or manipulative social practices — have entered the vernacular.",,39,,Ford Madox,Brown,1821-1893,56 Fortess Road,Kentish Town,51.5536,-0.14049,Arts,,Painter,,FORD MADOX BROWN 1821-1893 Painter lived here,http://en.wikipedia.org/wiki/Ford_Maddox_Brown,"Ford Madox Brown (1821-1893) was an English painter of moral and historical subjects, notable for his distinctly graphic version of the Pre-Raphaelite style. Brown's early work was greatly admired by the young Dante Gabriel Rossetti who asked Brown to tutor him. Although not a member of the Pre-Raphaelite Brotherhood, Brown remained closely linked to them. Brown's most famous painting is arguably ""Work"" which attempts to depict the totality of the mid-Victorian social experience in a single image. ",,40,,Thomas Hosmer,Shepherd,1793-1864,26 Batchelor Street,Islington,51.5353,-0.108542,Arts,,Artist,London,Thomas Hosmer Shepherd 1793-1864 Artist who portrayed London lived here,http://en.wikipedia.org/wiki/Thomas_Hosmer_Shepherd,"Thomas Hosmer Shepherd (1792 – 1864) was a watercolour artist well known for his architectural works. Brother of topographical artist George ""Sidney"" Shepherd, Thomas was employed to illustrate architecture in London, and later Edinburgh, Bath and Bristol. His paintings were the basis for steel engravings in many books.Shepherd's work, mostly topographical, is characterized by an attention to detail, along with life-like scenes that contained people, carriages and horses. He worked mostly for Frederick Crace, who employed him to paint old London buildings prior to their demolition, with much of the work surviving in the Crace collection at the British Museum",,41,Sir,Geoffrey,Jellicoe,1900-1996,19 Grove Terrace,Dartmouth Park,50.8273,-0.1631,Science & Engineering,,Architect,,Sir Geoffrey Jellicoe 1900-1996 Landscape Architect lived here 1936-1984 * Best-known English landscape architect of his generation ,http://en.wikipedia.org/wiki/Geoffrey_Jellicoe,"Sir Geoffrey Jellicoe (1900-1996) was an English landscape architect, garden designer, architect and designer. Jellicoe was born in Chelsea and studied at the Architectural Association in London before travelling to Rome in 1923. It was in Italy that Jellicoe's work on renaissance gardens, which were in a state of decay at that time, inspired much of his landscape architecture. Some of his key design projects included the design of new town Hemel Hempstead in 1947, Ditchley Park in Oxfordshire, Sutton Place in Surrey and the design of the John F Kennedy memorial in Egham, Surrey. ",,42,,Mary,Kingsley,1862-1900,22 Southwood Lane,Highgate,51.5716,-0.14882,Science & Engineering,,Traveller,Ethnologist,Mary Kingsley (1862-1900) Traveller and ethnologist lived here as a child,http://en.wikipedia.org/wiki/Mary_Kingsley,"Mary Henrietta Kingsley (1862-1900) was an English writer and pioneering explorer of west Africa, who greatly influenced European ideas about Africa and African people. Having lived a sheltered life and never marrying, Kingsley travelled to west Africa following the death of her father George Kingsley.  It was highly unusual for a woman of Kingsley's race, age and gender to embark on such a dangerous journey unaccompanied and despite several close encounters with crocodiles, cannibalistic tribesmen and disease Kingsley's publications and lectures were remarkably modest. She made a significant impact on ideas of the colonialism of Africa. Kingsley died working as a nurse during the Boer War and was interred at sea in accordance with her wishes. ",,43,,William Richard,Lethaby,1857-1931,20 Calthorpe Street,Clerkenwell,51.5247,-0.11511,Science & Engineering,,Architect,,William Richard Lethaby (1857-1931) Architect lived here 1880-1891 * highly influential in the late Arts and Crafts and early Modern movements in architecture,http://en.wikipedia.org/wiki/William_Richard_Lethaby,"William Richard Lethaby (1857 - 1931) was an English architect and architectural historian whose ideas were highly influential on the late Arts and Crafts and early Modern movements in architecture, and in the fields of conservation and art education. Born in 1857 at Barnstaple, Lethaby was the son of a carver and gilder. He studied at the local art school and in architects' offices in Barnstaple and Derby, winning the R.I.B.A.'s Sloane Medallion 1879 and the Pugin Studentship 1881. It was here in London that Lethaby founded the Central School of Arts and Crafts, now known as Central St. Martins. ",,44,,Mahatma,Gandhi,1869-1948,"Kingsley Hall, Powis Road",Bromley-by-Bow,51.5265,-0.014527,Politics,,Campaigner,,Mahatma Gandhi (1869-1948) stayed here in 1931,http://en.wikipedia.org/wiki/Gandhi,"Mohandas Karamchand Gandhi (1869-1948) often referred to as Mahatma Gandhi (""Great Soul"") was the pre-eminent political and ideological leader of India during the Indian independence movement. Gandhi's model of non-violent fight for civil rights and freedom that he called satyagraha inspired movements across the world. It was here in 1931 that Gandhi stayed during negotiations between the British government and the Indian nation: Gandhi was the sole representative of the Indian National Congress (INC). The Gandhi-Irwin pact that was signed in March 1931 was effectively a truce, with Gandhi agreeing to end the civil disobedience movement by the INC. ",,45,Sir,Henry Morton,Stanley,1841-1904,2 Richmond Terrace,Whitehall,51.5031,-0.123706,Explorer,Arts,Explorer,Writer,"Sir Henry Morton Stanley (1841-1904) Explorer and Writer lived and died here * Welsh journalist and explorer famous for his exploration of Africa and his search for David Livingstone. Upon finding Livingstone, Stanley allegedly uttered the now-famous greeting, ""Dr. Livingstone, I presume?""",http://en.wikipedia.org/wiki/Henry_Morton_Stanley,"Sir Henry Morton Stanley (1841-1904) was a Welsh journalist and explorer. Stanley was employed by the founder of the New York Herald Tribune to find the Scottish missionary and explorer David Livingstone who was known to be in Africa but who had not been heard from for some time. The 7000 mile journey through Zanzibar was extremely perilous, but Stanley found Livingstone on 10 November 1871 near Lake Tanganyika and greeted him with the now famous phrase, ""Doctor Livingstone, I presume?"" Stanley continued to explore the Congo region of Africa until his death in 1904, and his work book ""Through the Dark Continent"" is considered an inspiration for Joseph Conrad's ""Heart of Darkness.""",,46,,John McDouall,Stuart,1815-1866,9 Campden Hill Square,Holland Park,51.5073,-0.201568,Explorer,,Explorer,,John McDouall Stuart (1815-1866) First Explorer to cross Australia lived and died here,http://en.wikipedia.org/wiki/John_McDouall_Stuart,"John McDouall Stuart (1815-1866) was a Scottish explorer, and the first man to successfully lead an expedition to traverse the Australian mainland. Born in Scotland in 1866 Stuart trained as civil engineer before emigrating to Australia in 1838. Stuart led a total of six expeditions with the successful south to north journey from Adelaide to Darwin completed in 1862. The town Alice Springs was originally named Stuart in his honour, before being changed in 1933. Stuart died here in London in 1866. ",,47,,Robert Falcon,Scott,1868-1912,56 Oakley Street,Chelsea,51.4837,-0.167385,Explorer,,Explorer,,Robert Falcon Scott (1868-1912) Antarctic explorer lived here,http://en.wikipedia.org/wiki/Robert_Falcon_Scott,"Robert Falcon Scott (1868-1912) was a Royal Navy officer and explorer who led two expeditions to the Antarctic regions: the Discovery Expedition, 1901–04, and the ill-fated Terra Nova Expedition, 1910–13. During this second venture, Scott led a party of five which reached the South Pole on 17 January 1912, only to find that they had been preceded by Roald Amundsen's Norwegian expedition. On their return journey, Scott and his four comrades all perished from a combination of exhaustion, starvation and extreme cold. Scott's exploration of the Antarctic has made his name synonymous with the region, and he is regarded today as a brave and stoic leader, despite some errors on his part. ",,48,,Edward Adrian,Wilson,1872-1912,"Battersea Vicarage, 42 Vicarage Crescent",Battersea,51.4742,-0.17619,Explorer,Science & Engineering,Explorer,Naturalist,Edward Adrian Wilson (1872-1912) Antarctic explorer and naturalist lived here,http://en.wikipedia.org/wiki/Edward_Adrian_Wilson,"Edward A Wilson (1872-1912) was a polar explorer and expedition artist. Wilson travelled on two Antarctic expeditions: Discovery 1901-1904 and Terra Nova 1910-1912, both under the leadership of Robert Falcon Scott. Wilson developed a love of the countryside and natural history as a young boy, and having studied at Cambridge and in London as a doctor, joined the Discovery expedition as junior surgeon, zoologist and expedition artist. He was Chief of the Scientific Staff of Scott's final expedition. Affectionately known as ""Uncle Bill"" by the men, Wilson was the confidant of many, respected for his judgement, mediatory skills and dedication to others. By all accounts, Wilson was probably Scott's closest comrade of the expedition.",,49,,Charles,"Stanhope, 3rd Earl Stanhope",1753-1816,20 Mansfield Street,Marylebone,51.5193,-0.146102,Politics,Science & Engineering,Reformer,Inventor,Charles 3rd Earl Stanhope 1753-1816Reformer and Inventor lived here * Invented the Stanhope printing press,"http://en.wikipedia.org/wiki/Charles_Stanhope,_3rd_Earl_Stanhope","Charles Stanhope, 3rd Earl Stanhope aka Charles Mahon, 3rd Earl Stanhope FRS (3 August 1753 – 15 December 1816) was a British statesman and scientist. He was the father of the great traveller and Arabist Lady Hester Stanhope and brother-in-law of William Pitt the Younger. Stanhope was an accomplished scientist and inventor, inventing a printing press and lens which both bear his name. ",,50,Sir,Charles,Wheatstone,1802-1875,19 Park Crescent,Regent's Park,51.5229,-0.146816,Science & Engineering,,Scientist,Inventor,"SIR CHARLES WHEATSTONE 1802-1875 Scientist and Inventor lived here * a major figure in the development of telegraphy, amongst other achievements",http://en.wikipedia.org/wiki/Charles_Wheatstone,"Sir Charles Wheatstone (1802-1875) was an English scientist and inventor of many scientific breakthroughs of the Victorian era. As well as inventing the English concertina, the stereoscope and the Playfair cipher (an encryption technique), Wheatstone is perhaps best known for his contributions in the development of the Wheatstone bridge, which is used to measure unknown electrical resistance. He was also a major figure in the development of telegraphy. Following his death, Wheatstone's remains were brought to his house in Regent's Park, before being buried in Kensal Green Cemetery. ",,51,Sir,Benjamin,"Thompson, Count Rumford",1753-1814,168 Brompton Road,Knightsbridge,51.498,-0.166833,Science & Engineering,Explorer,Inventor,Adventurer,SIR BENJAMIN THOMPSON COUNT RUMFORD 1753-1814 Inventor and Adventurer lived here,http://en.wikipedia.org/wiki/Benjamin_Thompson,"Sir Benjamin Thompson, Count Rumford (1753-1814) was an American-born British physicist and inventor whose challenges to established theory were part of the nineteenth century revolution in thermodynamics. He also served as a Lieutenant-Colonel in the Loyalist forces in America during the American Revolutionary War. After the end of the war he moved to London where his administrative talents were recognized when he was appointed a full Colonel, and in 1784 received a knighthood from King George III. A prolific designer, he also drew designs for warships.",,52,,Dennis,Gabor,1900-1979,79 Queen's Gate,Knightsbridge,51.4944,-0.178905,Science & Engineering,,Physicist,Inventor,DENNIS GABOR 1900-1979 Physicist and Inventor of Holography lived here,http://en.wikipedia.org/wiki/Dennis_Gabor,"Dennis Gabor (1900-1979) was a Hungarian-British electrical engineer and inventor, most notable for inventing holography, for which he later received the 1971 Nobel Prize in Physics. Holography is the technique used to produce holograms. Gabor was originally from Budapest and studied in Berlin before fleeing Nazi Germany in 1933. Settling in Britain, Gabor moved to London in 1948 to work at Imperial College London where he worked until retirement. Following the rapid development of lasers and a wide variety of holographic applications (e.g., art, information storage, and the recognition of patterns), Gabor achieved acknowledged success and worldwide attention during his lifetime.",,53,,Joseph Aloysius,Hansom,1803-1882,27 Sumner Place,Chelsea,51.4908,-0.1733,Science & Engineering,,Architect,Inventor,"Joseph Aloysius Hansom 1803-1882 Architect, founder-editor of 'The Builder' and inventor of the Hansom Cab lived here",http://en.wikipedia.org/wiki/Joseph_Aloysius_Hansom,"Joseph Aloysius Hansom (26 October 1803 – 29 June 1882) was a prolific English architect working principally in the Gothic Revival style. As well as an accomplished architect and designer, Hansom invented the Hansom safety cab in 1834: an improved horse-drawn carriage that was fast, light and agile. Hansom also co-founded the eminent architectural journal ""The Builder"" in 1843 which still publishes today and is one of the oldest business-to-business magazines in the country. ",,54,Lord,William,Thomson,1824-1907,15 Eaton Place,Belgravia,51.4984,-0.1508,Science & Engineering,,Physicist,Inventor,"Lord William Thomspon (1824-1907) Physicist and Inventor lived here * Lord Kelvin, as he was known,  is widely known for realising that there was a lower limit to temperature, absolute zero; absolute temperatures are stated in units of kelvin in his honour",http://en.wikipedia.org/wiki/Lord_William_Thomson_Kelvin,"William Thomson, 1st Baron Kelvin (1824-1907) was a mathematical physicist and engineer. At the University of Glasgow he did important work in the mathematical analysis of electricity and formulation of the first and second laws of thermodynamics, and did much to unify the emerging discipline of physics in its modern form. Lord Kelvin is widely known for realising that there was a lower limit to temperature, absolute zero; absolute temperatures are stated in units of kelvin in his honour. He also carried out significant work on the transatlantic telegraph project. Lord Kelvin spent some time in London and he is interred at Westminster Abbey, close-by the final resting place of Sir Isaac Newton. ",,55,,John,Rae,1813-1893,4 Lower Addison Gardens,Holland Park,51.5031,-0.213001,Explorer,,Explorer,,John Rae (1813-1893) Arctic explorer lived and died here * Reported the fate of the Franklin Expedition ,http://en.wikipedia.org/wiki/John_Rae_(explorer),"John Rae (1813-1693) was a Scottish doctor who explored northern Canada and surveyed parts of the Northwest Passage. Rae studied medicine in Edinburgh before working as a surgeon in Ontario. Rae is perhaps best known for reporting the fate of the Franklin Expedition, a doomed British voyage of Arctic exploration led by Captain Sir John Franklin that departed England in 1845 and became icebound, losing all 128 men. Although Rae gained notoriety for reporting this, he was not as famous as other contemporary explorers, despite being willing to adopt and learn the ways of the indigenous Arctic people. ",,56,Sir,James Clark,Ross,1800-1862,2 Eliot Place,Blackheath,51.4678,0.000703,Explorer,,Explorer,,"Sir James Clark Ross (1800-1862) Polar Explorer lived here * explored the eastern side of what is now known as James Ross Island, discovering and naming Snow Hill Island and Seymour Island, in the Antarctic",http://en.wikipedia.org/wiki/Sir_James_Clark_Ross,"Sir James Clark Ross (1800-1862) was a British naval officer and explorer. He explored the Arctic with his uncle Sir John Ross and Sir William Parry, first embarking on a controversial voyage in 1818 in search of the Northwest Passage (a sea route through the Arctic ocean above North America). Ross later led his own expedition to Antarctica in 1839 which charted much of the coastline of the continent. In 1841, James Ross discovered the Ross Sea, Victoria Land, and the volcanoes Mount Erebus and Mount Terror, which were named after the expedition's vessels, and the following year explored the eastern side of what is now known as James Ross Island, discovering and naming Snow Hill Island and Seymour Island. ",,57,Sir,Ernest,Shackleton,1874-1922,12 Westwood Hill ,Sydenham,51.4278,-0.058764,Explorer,,Explorer,,Sir Ernest Shackleton (1874-1922) Antarctic Explorer lived here,http://en.wikipedia.org/wiki/Sir_Ernest_Shackleton,"Sir Ernest Henry Shackleton (1874-1922) was an Anglo-Irish polar explorer, one of the principal figures of the period known as the Heroic Age of Antarctic Exploration. Gaining valuable experience on RF Scott's Discovery expedition 1901-1904, Shackleton went on to command three voyages of his own. The most famous expedition, Endurance 1914-1916, ended in near-disaster when the vessel became trapped in pack ice and was crushed. There followed a sequence of exploits, and an ultimate escape with no lives lost, thus securing Shackleton's heroic status. He died of a heart attack in 1921 while circumnavigating the Antarctic continent. ",,58,,William Ewart,Gladstone,1809-1898,73 Harley Street,Marylebone,51.5197,-0.1473,Politics,Science & Engineering,Statesman,,In a house on this site lived from 1854-1875 SIR CHARLES LYELL Geologist and from 1876-1882 W.E. GLADSTONE Statesman,http://en.wikipedia.org/wiki/W._E._Gladstone,"This building first housed Sir Charles Lyell (1797-1875) a British lawyer who was the foremost geologist of his day. He is best known as the author of Principles of Geology, which popularised James Hutton's concepts of uniformitarianism – the idea that the earth was shaped by slow-moving forces still in operation today. Lyell was a close and influential friend of Charles Darwin. Following his death the house was occupied by William Ewart Gladstone (1809-1898). Gladstone was a British Liberal statesman who, in a career lasting over sixty years, served as Prime Minister four times (more than any other person). Gladstone is famous for his oratory, his rivalry with the Conservative leader Benjamin Disraeli and his poor relations with Queen Victoria. ",,